{
  "phase": "training",
  "model_name": "mobilenet_v3",
  "dataset_id": "imagenet_tiny",
  "image_count": 10000,
  "metrics": {
    "loss": 2.3
  },
  "latency_ms": 180.0,
  "batch_size": 16,
  "hardware": { "device": "GPU", "memory_gb": 8 },
  "result": "failure",
  "error": { "message": "Out of memory on device 0" }
}
