{
  "phase": "evaluation",
  "model_name": "deeplabv3_resnet101",
  "dataset_id": "cityscapes_eval",
  "image_count": 500,
  "metrics": {
    "f1_score": 0.78,
    "precision": 0.8,
    "recall": 0.77
  },
  "latency_ms": 200,
  "batch_size": 8,
  "hardware": {
    "device": "GPU",
    "memory_gb": 16
  },
  "result": "success"
}
